{
  "name": "16bit-sfc",
  "style": "SFC/GBA 16-bit chiptune",
  "description": "温润柔和的 SFC 风格音色，适合像素风游戏",
  "timbres": {
    "lead": {
      "provider": "oscillator",
      "waveforms": [
        { "type": "square", "gain": 0.5, "detune": -4 },
        { "type": "square", "gain": 0.25, "detune": 4 }
      ],
      "filter": { "type": "lowpass", "frequency": 2800, "Q": 1 },
      "envelope": { "attack": 5, "decay": 30, "sustain": 0.3, "release": 60 }
    },
    "bass": {
      "provider": "oscillator",
      "waveforms": [
        { "type": "triangle", "gain": 0.6 },
        { "type": "square", "gain": 0.15, "detune": -6 }
      ],
      "filter": { "type": "lowpass", "frequency": 800, "Q": 0.8 },
      "envelope": { "attack": 2, "decay": 20, "sustain": 0.5, "release": 40 }
    },
    "pad": {
      "provider": "oscillator",
      "waveforms": [
        { "type": "sine", "gain": 0.4, "detune": -7 },
        { "type": "sine", "gain": 0.4, "detune": 7 },
        { "type": "triangle", "gain": 0.2 }
      ],
      "filter": { "type": "lowpass", "frequency": 1500, "Q": 0.5 },
      "envelope": { "attack": 80, "decay": 100, "sustain": 0.6, "release": 200 }
    },
    "arp": {
      "provider": "oscillator",
      "waveforms": [{ "type": "square", "gain": 0.35 }],
      "filter": { "type": "lowpass", "frequency": 3500, "Q": 1.5 },
      "envelope": { "attack": 1, "decay": 15, "sustain": 0, "release": 20 }
    },
    "kick": {
      "provider": "oscillator",
      "waveforms": [{ "type": "sine", "gain": 0.7 }],
      "envelope": { "attack": 1, "decay": 80, "sustain": 0, "release": 60 },
      "pitch": { "start": 1.5, "end": 0.5 }
    },
    "snare": {
      "provider": "oscillator",
      "waveforms": [
        { "type": "noise", "gain": 0.5 },
        { "type": "triangle", "gain": 0.3 }
      ],
      "filter": { "type": "highpass", "frequency": 500, "Q": 0.7 },
      "envelope": { "attack": 1, "decay": 40, "sustain": 0, "release": 30 }
    },
    "hihat": {
      "provider": "oscillator",
      "waveforms": [{ "type": "noise", "gain": 0.2 }],
      "filter": { "type": "highpass", "frequency": 6000, "Q": 0.5 },
      "envelope": { "attack": 0, "decay": 10, "sustain": 0, "release": 5 }
    }
  }
}
